Question,Focus (Drug),Question Type,Answer,Section Title,URL
how long for donepezil to show in your blood,donepezil,Action/time,"Based on population pharmacokinetic analysis of plasma donepezil concentrations measured in patients with Alzheimer's disease, following oral dosing, peak plasma concentration is achieved in 3 hours for donepezil hydrochloride 10 mg tablets.",CLINICAL PHARMACOLOGY,https://dailymed.nlm.nih.gov/dailymed/drugInfo.cfm?setid=11ac01f4-d26e-47b2-9660-d514ab097fdb
"for a ""rinse,"" how many ""cc"" should be ""used?f"" lidocaine lidocaine used",lidocaine rinse,Usage,"For symptomatic treatment of irritated or inflamed mucous membranes of the mouth and pharynx, the usual adult dose is 15 mL undiluted.",DOSAGE AND ADMINISTRATION,https://dailymed.nlm.nih.gov/dailymed/drugInfo.cfm?setid=79b42076-359d-4258-b1d8-f40e67ac5424
how many cc of lidocaine is a dose?,lidocaine,Dose,"For symptomatic treatment of irritated or inflamed mucous membranes of the mouth and pharynx, the usual adult dose is 15 mL undiluted.",DOSAGE AND ADMINISTRATION,https://dailymed.nlm.nih.gov/dailymed/drugInfo.cfm?setid=79b42076-359d-4258-b1d8-f40e67ac5424
what medicine besides statins lower cholesterol?,statins,Alternatives,"Fibrates ... Fenofibrate (TriCor) ... Gemfibrozil (Lopid) ... Resins ... Cholestyramine (Questran, LoCholest) ... Colestipol (Colestid) ... Colesevelam (WelChol) ... Absorption Blocker ... Ezetimibe (Zetia) ... Niacin ...",,https://www.health.harvard.edu/newsletter_article/help-for-your-cholesterol-when-the-statins-wont-do
what does the pill oxybutynin look like,oxybutynin,Appearance,Product Characteristics Color BLUE (light blue) Score 2 pieces Shape ROUND Size 8mm Imprint Code 4853;V,INGREDIENTS AND APPEARANCE,https://dailymed.nlm.nih.gov/dailymed/drugInfo.cfm?setid=fd72314e-773a-4e9d-8aa7-ec51592e4c90
what is the normal dose of lactulose,lactulose,Dose,"The usual dose is 1 to 2 tablespoonfuls (15 to 30 mL, containing 10 g to 20 g of lactulose) daily.",DOSAGE AND ADMINISTRATION,https://dailymed.nlm.nih.gov/dailymed/drugInfo.cfm?setid=387b0fc9-1a02-48dd-a9e5-a157f3831646
what pills are not compatible with hydrocodone,hydrocodone,Interaction,"Taking certain medications or stopping treatment with certain other medications while you are taking hydrocodone may increase the risk that you will experience breathing problems, sedation, coma, or other serious, life-threatening side effects. Tell your doctor if you are taking, plan to take or plan to stop taking any of the following medications: certain antifungal medications including itraconazole (Onmel, Sporanox), ketoconazole (Extina, Nizoral, Xolegel), and voriconazole (Vfend); benzodiazepines such as alprazolam (Xanax), chlordiazepoxide (Librium), clonazepam (Klonopin), diazepam (Diastat, Valium), estazolam, flurazepam, lorazepam (Ativan), oxazepam, temazepam (Restoril), and triazolam (Halcion); carbamazepine (Carbatrol, Epitol, Equetro, Tegretol, others); cimetidine; clarithromycin (Biaxin, in Prevpac); erythromycin (E.E.S., Erythromycin, others); other narcotic pain medications; medications for mental illness or nausea; certain medications for human immunodeficiency virus (HIV) including ritonavir (Norvir, in Kaletra, in Viekira Pak); muscle relaxants; phenytoin (Dilantin, Phenytek); rifampin (Rifadin, Rimactane, in Rifamate, in Rifater); sedatives; sleeping pills; or tranquilizers.",IMPORTANT WARNING,https://medlineplus.gov/druginfo/meds/a614045.html
shingrix vaccine how often do you get a shingles shot,shingles vaccine,Usage/time,"Shingles Vaccine (recombinant)  Two doses, 2 to 6 months apart, are recommended for adults 50 and older.  This vaccine is also recommended for people who have already gotten the live shingles vaccine (Zostavax). There is no live virus in this vaccine.",Shingles Vaccine (recombinant),https://www.cdc.gov/vaccines/hcp/vis/vis-statements/shingles-recombinant.html
how long will suboxone block opioid,suboxone,Action,"Suboxone typically lasts up to 3 days. Most doctors ask their patients to take the drug once per day, typically at the same time each day. A person’s weight, metabolism, and history of drug abuse can lengthen or shorten the action of Suboxone. It’s best to work with a doctor on a customized dose, based on your medical history.",How long does Suboxone last in your system?,https://americanaddictioncenters.org/suboxone/length-of-blocking-effect/
how to stop taking trazodone,trazodone,Stopping/tapering,"Do not stop taking trazodone without talking to your doctor. If you suddenly stop taking trazodone, you may experience withdrawal symptoms such as anxiety, agitation, or difficulty falling asleep or staying asleep. Your doctor will probably decrease your dose gradually.",How should this medicine be used?,https://medlineplus.gov/druginfo/meds/a681038.html
does marijuana use lead to negative health outcomes?,marijuana,Side effects,"Marijuana can cause problems with memory, learning, and behavior. Smoking it can cause some of the same coughing and breathing problems as smoking cigarettes. Some people get addicted to marijuana after using it for a while. It is more likely to happen if they use marijuana every day, or started using it when they were teenagers.",Summary,https://medlineplus.gov/marijuana.html
blood pressure when on eliquis,Eliquis,Side effects,Less common adverse reactions … Vascular disorders: hypotension (including procedural hypotension),ADVERSE REACTIONS,https://dailymed.nlm.nih.gov/dailymed/drugInfo.cfm?setid=e9481622-7cc6-418a-acb6-c5450daae9b0
what do i mix albuterol sulfate inhalation solution with in my nebulizer?,albuterol sulfate inhalation solution,Usage,"Albuterol sulfate inhalation solution is supplied as a single-dose, ready-to-use vial containing 3 mL of solution. No mixing or dilution is needed. Use one new vial with each nebulizer treatment.",PATIENT'S INSTRUCTIONS FOR USE,https://dailymed.nlm.nih.gov/dailymed/drugInfo.cfm?setid=ab1cbed4-50c4-4769-9947-1927333f278c
what color metoprolol,metoprolol,Appearance,Product Characteristics Color WHITE Score 2 pieces Shape OVAL (Capsule-Shaped) Size 11mm Flavor Imprint Code M,INGREDIENTS AND APPEARANCE,https://dailymed.nlm.nih.gov/dailymed/drugInfo.cfm?setid=ff391fc7-a0ab-4f8c-927e-2588053c7021
"tramadol ""milligrams?""",tramadol,Dose,"Adults (17 years of age and over): For patients with moderate to moderately severe chronic pain not requiring rapid onset of analgesic effect, the tolerability of tramadol hydrochloride can be improved by initiating therapy with a titration regimen. The total daily dose may be increased by 50 mg as tolerated every 3 days to reach 200 mg/day (50 mg q.i.d.). After titration, tramadol hydrochloride tablets 50 mg to 100 mg can be administered as needed for pain relief every four to six hours, not to exceed 400 mg per day.",DOSAGE AND ADMINISTRATION,https://dailymed.nlm.nih.gov/dailymed/drugInfo.cfm?setid=ae7c54b1-b440-4cca-97e8-e5b825413d32
what ppis this medication for simvastatin,"simvastatin, PPI",Interaction,PPIs may modestly boost the statin-mediated LDL-C reduction.,Proton pump inhibitors and statins: a possible interaction that favors low-density lipoprotein cholesterol reduction?,https://www.ncbi.nlm.nih.gov/pmc/articles/PMC5033144/https://www.ncbi.nlm.nih.gov/pmc/articles/PMC5033144/
how to give insulin,insulin,Usage,Insulin comes as a solution (liquid) and a suspension (liquid with particles that will settle on standing) to be injected subcutaneously (under the skin). Insulin is usually injected several times a day … [whole section],How should this medicine be used?,https://medlineplus.gov/druginfo/meds/a682611.html
how often do i get the pneumococcal conjugate vaccine,pneumococcal conjugate vaccine,Usage/time,Vaccination Schedule for Adults 18 Years of Age and Older: Prevnar 13 is administered as a single dose.,DOSAGE AND ADMINISTRATION,https://dailymed.nlm.nih.gov/dailymed/drugInfo.cfm?setid=5d49181b-b974-a5da-3b38-12a3a87bb96b#S2.6
what are the active ingredients in bimatoprost,bimatoprost,Ingredient,Active Ingredient/Active Moiety: Ingredient Name  bimatoprost (UNII: QXS94885MZ) (bimatoprost - UNII:QXS94885MZ),INGREDIENTS AND APPEARANCE,https://dailymed.nlm.nih.gov/dailymed/drugInfo.cfm?setid=f5c1c8c6-2a7f-482b-6ecf-9cabd3a6a5c1
how does it take for strattera to begin to show some improvement,Strattera,Action/time,"Some people report small changes in hyperactivity and impulse control within two weeks, but it may take 4 to 8 weeks for the drug to achieve maximum effectiveness.",How long does it usually take for Strattera to work?,https://www.psycom.net/strattera-atomoxetine
will citalopram exacerbate heart arrhythmias?,citalopram,Side effects,"QT-Prolongation and Torsade de Pointes: Citalopram causes dose-dependent QTc prolongation, an ECG abnormality that has been associated with Torsade de Pointes (TdP), ventricular tachycardia, and sudden death, all of which have been observed in postmarketing reports for citalopram.... [whole subsection]",WARNINGS,https://dailymed.nlm.nih.gov/dailymed/drugInfo.cfm?setid=2632b547-2e13-447f-ac85-c774e437d6a8
what does marijuana look like,marijuana,Appearance,"Marijuana is a green, brown, or gray mix of dried, crumbled parts from the marijuana plant.",Summary,https://medlineplus.gov/marijuana.html
nitroglycerin how it works,nitroglycerin,Action,"The principal pharmacological action of nitroglycerin is relaxation of vascular smooth muscle and consequent dilatation of peripheral arteries and veins, especially the latter. Dilatation of the veins promotes peripheral pooling of blood and decreases venous return to the heart, thereby reducing left ventricular end-diastolic pressure and pulmonary capillary wedge pressure (preload). Arteriolar relaxation reduces systemic vascular resistance, systolic arterial pressure, and mean arterial pressure (afterload). Dilatation of the coronary arteries also occurs. The relative importance of preload reduction, afterload reduction, and coronary dilatation remains undefined.",CLINICAL PHARMACOLOGY,https://dailymed.nlm.nih.gov/dailymed/drugInfo.cfm?setid=a1648bd9-8a89-4292-b703-aa83d9bd6c6d
"what is an esi shot in the ""back?"" epidural steroids shot in the ""back?""",epidural steroid injection (ESI),Information,"An epidural steroid injection (ESI) is a minimally invasive procedure that can help relieve neck, arm, back, and leg pain caused by inflamed spinal nerves due to spinal stenosis or disc herniation. Medicines are delivered to the epidural space, which is a fat-filled area between the bone and the protective sac of the spinal nerves.",Overview,https://mayfieldclinic.com/pe-esi.htm
what is medication for singular 10 mg.,Singulair,Indication,"SINGULAIR is indicated for the prophylaxis and chronic treatment of asthma in adults and pediatric patients 12 months of age and older. SINGULAIR is indicated for prevention of exercise-induced bronchoconstriction in patients 15 years of age and older. SINGULAIR is indicated for the relief of symptoms of allergic rhinitis (seasonal allergic rhinitis in adults and pediatric patients 2 years of age and older, and perennial allergic rhinitis in adults and pediatric patients 6 months of age and older).",INDICATIONS AND USAGE,https://dailymed.nlm.nih.gov/dailymed/drugInfo.cfm?setid=10cd5ca5-6f8b-417c-af11-a2054a2dde34
"diclofenac sodium, 75 mg. how much is to much",diclofenac sodium,Overdose,"Diclofenac sodium may be administered as 25 mg, 50 mg, or 75 mg delayed-release tablets. Regardless of the indication, the dosage of diclofenac should be individualized to the lowest effective dose to minimize adverse effects (see CLINICAL PHARMACOLOGY: Individualization of Dosage). Osteoarthritis: The recommended dosage is 100 to 150 mg/day in divided doses, 50 mg b.i.d. or t.i.d. or 75 mg b.i.d. Dosages above 150 mg/day have not been studied in patients with osteoarthritis. Rheumatoid Arthritis: The recommended dosage is 150 to 200 mg/day in divided doses, 50 mg t.i.d. or q.i.d., or 75 mg b.i.d. Dosages above 225 mg/day are not recommended in patients with rheumatoid arthritis. Ankylosing Spondylitis: The recommended dosage is 100 to 125 mg/day, administered as 25 mg q.i.d., with an extra 25 mg dose at bedtime if necessary. Dosages above 125 mg/day have not been studied in patients with ankylosing spondylitis.",DOSAGE AND ADMINISTRATION,https://dailymed.nlm.nih.gov/dailymed/drugInfo.cfm?setid=a4fd2d68-019f-4c89-8923-4e61262f6eee
what upis this medication for simvastatin,simvastatin,unanswerable,No Answers,,
"any ""side effects"" when stop taking clopidogrel",clopidogrel,Stopping/side effects,"Discontinuation of clopidogrel bisulfate increases the risk of cardiovascular events. If clopidogrel must be temporarily discontinued (e.g., to treat bleeding or for surgery with a major risk of bleeding), restart it as soon as possible. When possible, interrupt therapy with clopidogrel for five days prior to such surgery. Resume clopidogrel as soon as hemostasis is achieved.",WARNINGS AND PRECAUTIONS,https://dailymed.nlm.nih.gov/dailymed/drugInfo.cfm?setid=edae8df1-caf9-ff72-1304-5ae8b355f8e7
can hormonal contraceptives be used for medical reasons?,hormonal contraceptives,Indication,Medical Uses of the Birth Control Pill … [whole page],,https://youngwomenshealth.org/2011/10/18/medical-uses-of-the-birth-control-pill/
what opioid is in the bupropion patch,"""bupropion patch"" (probably buprenorphine [Butrans])",Ingredient,Active Ingredient/Active Moiety: Ingredient Name buprenorphine (UNII: 40D3SCR4GZ) (buprenorphine - UNII:40D3SCR4GZ),INGREDIENTS AND APPEARANCE,https://dailymed.nlm.nih.gov/dailymed/drugInfo.cfm?setid=794aa355-66de-41b8-aedf-f2c40f6bc664
what is nicoderm,Nicoderm,Information,"reduces withdrawal symptoms, including nicotine craving, associated with quitting smoking",Uses,https://dailymed.nlm.nih.gov/dailymed/drugInfo.cfm?setid=93b2d1b9-83c1-40b5-b6af-90c38c8d6cef
if wanting to change from duragesic patch to oxycontin how are doseages compared,duragesic patch and oxycontin,Comparison,"Based on TDF patch strength, calculate oral morphine equivalent (or other opioid equivalent). If converting to oral morphine, use the 2 mg oral morphine/day ~ 1 mcg/h TDF rule",Converting from tdF to an oral opioid,https://www.ashp.org/-/media/store-files/p1985-sample-chapter-5.ashx
what is fluoride,fluoride,Information,"The mineral fluoride occurs naturally on earth and is released from rocks into the soil, water, and air. All water contains some fluoride. Usually, the fluoride level in water is not enough to prevent tooth decay; however, some groundwater and natural springs can have naturally high levels of fluoride. Fluoride has been proven to protect teeth from decay. Bacteria in the mouth produce acid when a person eats sugary foods. This acid eats away minerals from the tooth’s surface, making the tooth weaker and increasing the chance of developing cavities. Fluoride helps to rebuild and strengthen the tooth’s surface, or enamel. Water fluoridation prevents tooth decay by providing frequent and consistent contact with low levels of fluoride. By keeping the tooth strong and solid, fluoride stops cavities from forming and can even rebuild the tooth’s surface.",,https://www.cdc.gov/fluoridation/basics/index.htm
why is losartin prescribed rather than a calcium channel blocker.,losartan,Comparison,"Losartan is in a class of medications called angiotensin II receptor antagonists. It works by blocking the action of certain natural substances that tighten the blood vessels, allowing the blood to flow more smoothly and the heart to pump more efficiently.",Why is this medication prescribed?,https://medlineplus.gov/druginfo/meds/a695008.html
"when used as a rinse, how big should the amount of lidocaineof lidocaine used",lidocaine rinse,Dose,"Lidocaine viscous comes as a thick liquid and should be shaken well before using. Lidocaine viscous usually is used as needed but not more frequently than every 3 hours, with a maximum of 8 doses in 24 hours. In children under 3 years of age, do not use more frequently than every 3 hours, with a maximum of 4 doses in 12 hours. Follow the directions on your prescription label carefully, and ask your doctor or pharmacist to explain any part you do not understand. Use lidocaine exactly as directed. Do not use more or less of it or use it more often than prescribed by your doctor.",How should this medicine be used?,https://medlineplus.gov/druginfo/meds/a682701.html
is it safe to add peppermint essential oil in mouthwash?,peppermint oil,Side effects,"Peppermint oil appears to be safe when taken orally (by mouth) in the doses commonly used. Excessive doses of peppermint oil can be toxic.     Possible side effects of peppermint oil include allergic reactions and heartburn. Capsules containing peppermint oil are often enteric-coated to reduce the likelihood of heartburn. If enteric-coated peppermint oil capsules are taken at the same time as antacids, the coating can break down too quickly.     Like other essential oils, peppermint oil is highly concentrated. When the undiluted essential oil is used for health purposes, only a few drops are used.     Side effects of applying peppermint oil to the skin can include skin rashes and irritation. Peppermint oil should not be applied to the face or chest of infants or young children because serious side effects may occur if they inhale the menthol in the oil.     No harmful effects of peppermint leaf tea have been reported. However, the long-term safety of consuming large amounts of peppermint leaf is unknown.",What Do We Know About Safety?,https://nccih.nih.gov/health/peppermintoil
how to identify clonidine tablets,clonidine,Appearance,Product Characteristics Color WHITE Score no score Shape ROUND (biconvex) Size 6mm Flavor Imprint Code A;16,INGREDIENTS AND APPEARANCE,https://dailymed.nlm.nih.gov/dailymed/drugInfo.cfm?setid=accb2879-7c0e-40d9-bc78-af78fc619609
enoxaparin shot admin they injected into my kidney what will i do,enoxaparin shot,Information,"If patients have had neuraxial anesthesia or spinal puncture, and particularly, if they are taking concomitant NSAIDs, platelet inhibitors, or other anticoagulants, they should be informed to watch for signs and symptoms of spinal or epidural hematoma, such as tingling, numbness (especially in the lower limbs) and muscular weakness. If any of these symptoms occur the patient should contact his or her physician immediately.  Additionally, the use of aspirin and other NSAID's may enhance the risk of hemorrhage. Their use should be discontinued prior to enoxaparin therapy whenever possible; if co-administration is essential, the patient's clinical and laboratory status should be closely monitored [see Drug Interactions (7)].  Patients should also be informed:      of the instructions for injecting Enoxaparin Sodium Injection if their therapy is to continue after discharge from the hospitals.     it may take them longer than usual to stop bleeding.     they may bruise and/or bleed more easily when they are treated with Enoxaparin Sodium Injection.     they should report any unusual bleeding, bruising, or signs of thrombocytopenia (such as a rash of dark red spots under the skin) to their physician [see Warnings and Precautions (5.1, 5.5)].     to tell their physicians and dentists they are taking Enoxaparin Sodium Injection and/or any other product known to affect bleeding before any surgery is scheduled and before any new drug is taken [see Warnings and Precautions (5.3)].     to tell their physicians and dentists of all medications they are taking, including those obtained without a prescription, such as aspirin or other NSAID's [see Drug Interactions (7)].",PATIENT COUNSELING INFORMATION,https://dailymed.nlm.nih.gov/dailymed/drugInfo.cfm?setid=3e6bf2b3-9339-4104-bda3-ad86a1949703
what is marijuana,marijuana,Information,"Marijuana is a green, brown, or gray mix of dried, crumbled parts from the marijuana plant.",Summary,https://medlineplus.gov/marijuana.html
how to safely stop taking anastrozole,anastrozole,Stopping/tapering,A study has found that postmenopausal women who stop taking hormonal therapy early or skip doses are much more likely to have a breast cancer recurrence than women who take hormonal therapy as prescribed.,,https://www.breastcancer.org/research-news/not-taking-hormonal-tx-leads-to-more-recurrence
"vitamin d 15000,what can do for bones",vitamin D,Action,"Vitamin D helps your body absorb calcium. Calcium is one of the main building blocks of bone. A lack of vitamin D can lead to bone diseases such as osteoporosis or rickets. Vitamin D also has a role in your nerve, muscle, and immune systems.",Summary,https://medlineplus.gov/vitamind.html
metformin after dinner and bed time?,metformin,Usage,"Metformin hydrochloride extended-release tablets, USP should generally be given once daily with the evening meal.",DOSAGE AND ADMINISTRATION,https://dailymed.nlm.nih.gov/dailymed/drugInfo.cfm?setid=6d6ee6f8-9650-ff4f-e053-2991aa0acf19
what is cortisol,cortisol,Information,"Cortisol is a steroid hormone, in the glucocorticoid class of hormones. When used as a medication, it is known as hydrocortisone. It is produced in humans by the zona fasciculata of the adrenal cortex within the adrenal gland.[1] It is released in response to stress and low blood-glucose concentration. It functions to increase blood sugar through gluconeogenesis, to suppress the immune system, and to aid in the metabolism of fat, protein, and carbohydrates.[2] It also decreases bone formation.[3]",,https://en.wikipedia.org/wiki/Cortisol
effects of salt of epson to diabetes?,Epsom salt,Contraindication,"While Epsom salt baths can be relaxing, they are not recommended for people with diabetes. Epsom salt is made up of magnesium sulfate. Why does that matter? When Epsom salts are added to a warm bath, some magnesium can be absorbed through the skin, causing an increased release of insulin, leading to hypoglycemia (low blood sugar).",,"http://www.emedtv.com/managing-your-type-2-diabetes/if-i-have-diabetes,-can-i-take-epsom-salt-baths.html"
1 mg ativan ccis a small does of ativan for adults?,Ativan,Dose,"Ativan (lorazepam) is administered orally. For optimal results, dose, frequency of administration, and duration of therapy should be individualized according to patient response. To facilitate this, 0.5 mg, 1 mg, and 2 mg tablets are available. The usual range is 2 to 6 mg/day given in divided doses, the largest dose being taken before bedtime, but the daily dosage may vary from 1 to 10 mg/day. For anxiety, most patients require an initial dose of 2 to 3 mg/day given two times a day or three times a day. For insomnia due to anxiety or transient situational stress, a single daily dose of 2 to 4 mg may be given, usually at bedtime. For elderly or debilitated patients, an initial dosage of 1 to 2 mg/day in divided doses is recommended, to be adjusted as needed and tolerated. The dosage of Ativan (lorazepam) should be increased gradually when needed to help avoid adverse effects. When higher dosage is indicated, the evening dose should be increased before the daytime doses.",DOSAGE AND ADMINISTRATION,https://dailymed.nlm.nih.gov/dailymed/drugInfo.cfm?setid=89057c93-8155-4040-acec-64e877bd2b4c
"what help withdrawal ""fom."" hydrocodone 10 325",hydrocodone + acetaminophen,Stopping/tapering,Narcotics Anonymous (N.A.) assists people who want to stop abusing prescription or illegal drugs. Find a meeting center or online support group by searching for the local helpline or website for the area where the meeting is located.,Find Local Help Centers for Alcohol and Drug Addiction,https://www.usa.gov/mental-health-substance-abuse#item-35032
what is prochlorperazine,prochlorperazine,Information,"For control of severe nausea and vomiting. 
For the treatment of schizophrenia.

Prochlorperazine is effective for the short-term treatment of generalized non-psychotic anxiety. However, prochlorperazine is not the first drug to be used in therapy for most patients with non-psychotic anxiety, because certain risks associated with its use are not shared by common alternative treatments (e.g., benzodiazepines).

When used in the treatment of non-psychotic anxiety, prochlorperazine should not be administered at doses of more than 20 mg per day or for longer than 12 weeks, because the use of prochlorperazine at higher doses or for longer intervals may cause persistent tardive dyskinesia that may prove irreversible (see WARNINGS).

The effectiveness of prochlorperazine as treatment for non-psychotic anxiety was established in 4-week clinical studies of outpatients with generalized anxiety disorder. This evidence does not predict that prochlorperazine will be useful in patients with other non-psychotic conditions in which anxiety, or signs that mimic anxiety, are found (e.g., physical illness, organic mental conditions, agitated depression, character pathologies, etc.).

Prochlorperazine has not been shown effective in the management of behavioral complications in patients with mental retardation.",INDICATIONS AND USAGE,https://dailymed.nlm.nih.gov/dailymed/drugInfo.cfm?setid=b05bc20e-cd19-ab40-1ad0-84a115d6d69e
